{
  "$schema": "./slab-schema.json",
  "system": {
    "computerName": "EXHIBIT-PC-01",
    "timezone": "Eastern Standard Time",
    "enableDailyReboot": false,
    "rebootTime": "06:00"
  },
  "autologon": {
    "enabled": false,
    "username": "exhibit",
    "disablePasswordlessHello": true
  },
  "startupTask": {
    "enabled": true,
    "workingDir": "C:\\Exhibit",
    "executable": "launch.bat",
    "trigger": "AtLogon",
    "delay": "PT1M"
  },
  "packageManager": {
    "provider": "winget",
    "allowOfflineFallback": true,
    "localInstallersPath": ".\\installers",
    "apps": [
      "Node.js",
      "Git.Git"
    ]
  },
  "lockdown": {
    "disableScreensaver": true,
    "disableAccessibilityShortcuts": true,
    "disableEdgeSwipes": true,
    "disableTouchFeedback": true,
    "disableWindowsUpdate": true,
    "disableWindowsWidgets": true,
    "disableOOBEPrompts": true,
    "clearDesktopIcons": true,
    "blackDesktopBackground": true,
    "configureExplorer": true,
    "disableAppInstalls": true,
    "disableAppRestore": true,
    "disableErrorReporting": true,
    "disableFirewall": false,
    "disableMaxPathLength": true,
    "disableNewNetworkWindow": true,
    "disableNotifications": true,
    "disableTouchGestures": true,
    "enableScriptExecution": true,
    "resetTextScale": true,
    "uninstallBloatware": true,
    "uninstallOneDrive": true,
    "unpinStartMenuApps": true,
    "setPowerSettings": true
  }
}
